{
  "name": "nextjs",
  "description": "TypeScript/React/Tailwind/Next.js/Node/Auth.js/Prisma/PostgreSQL/BullMQ.",
  "extends": [
    "core"
  ],
  "skills": [
    "typescript-engineering",
    "react-engineering",
    "tailwind-engineering",
    "nextjs-engineering",
    "nodejs-engineering",
    "authjs-engineering",
    "prisma-engineering",
    "postgresql-engineering",
    "async-jobs"
  ]
}
